{"id":"3f6c2a8e-91d4-4b7a-bc15-0e7d5f2a9c41","schemaVersion":1,"name":"Demo Fabrik","generatedAt":"2026-09-22T18:30:05Z","staleAfterSec":180,"tiles":[{"id":"t_line","view":"label","title":"Linie 1","titleShort":"Linie","icon":"bolt.horizontal","status":"ok","value":"Läuft","subtext":"Seit 20:21 · Spätschicht, noch 1:29 h"},{"id":"t_order","view":"label","title":"Auftrag 4711","titleShort":"AU 4711","icon":"doc.text","status":"ok","value":1776,"unit":"Stk","decimals":0,"subtext":"von 2.000 Stk · alle Schichten · Prognose 22:35 · im Plan"},{"id":"t_oee","view":"gauge","title":"OEE Schicht","titleShort":"OEE","icon":"speedometer","status":"warning","value":79.3,"unit":"%","decimals":1,"range":{"min":0,"max":100},"target":85,"bands":[{"to":60,"status":"critical"},{"to":80,"status":"warning"},{"to":100,"status":"ok"}],"subtext":"Verfügbarkeit 85,6 % · Leistung 95,1 % · Qualität 97,3 %"},{"id":"t_shift","view":"progress","title":"Gutteile Schicht","titleShort":"Schicht","icon":"shippingbox","status":"warning","value":580,"unit":"Stk","decimals":0,"range":{"min":0,"max":904},"target":735,"subtext":"Soll bis jetzt 735 Stk · 155 Stk im Rückstand"},{"id":"t_scrap","view":"progress","title":"Ausschussquote Schicht","titleShort":"Ausschuss","icon":"trash","status":"warning","value":2.7,"unit":"%","decimals":1,"range":{"min":0,"max":5},"target":1,"bands":[{"to":1,"status":"ok"},{"to":3,"status":"warning"},{"to":100,"status":"critical"}],"subtext":"16 von 596 Stk gefertigt"},{"id":"t_takt","view":"line","title":"Taktzeit","titleShort":"Takt","icon":"timer","value":32.3,"unit":"s","decimals":1,"target":32,"range":{"min":0,"max":45},"series":[{"name":"Ist","samples":[["2026-09-22T18:12:50Z",33.6],["2026-09-22T18:13:35Z",33.8],["2026-09-22T18:14:20Z",33.7],["2026-09-22T18:15:05Z",33.9],["2026-09-22T18:15:50Z",33.7],["2026-09-22T18:16:35Z",34.2],["2026-09-22T18:17:20Z",33.9],["2026-09-22T18:18:05Z",34.2],["2026-09-22T18:18:50Z",34.4],["2026-09-22T18:19:35Z",33.9],["2026-09-22T18:20:20Z",33.6],["2026-09-22T18:21:05Z",33.7],["2026-09-22T18:21:50Z",33.5],["2026-09-22T18:22:35Z",33.3],["2026-09-22T18:23:20Z",33.4],["2026-09-22T18:24:05Z",33],["2026-09-22T18:24:50Z",33],["2026-09-22T18:25:35Z",33],["2026-09-22T18:26:20Z",33],["2026-09-22T18:27:05Z",33.4],["2026-09-22T18:27:50Z",33],["2026-09-22T18:28:35Z",32.6],["2026-09-22T18:29:20Z",32.5],["2026-09-22T18:30:05Z",32.3]]}],"subtext":"Letzte 17 min · Ø 33,4 s"},{"id":"t_defects","view":"donut","title":"Fehlersammelkarte Schicht","titleShort":"Fehler","icon":"exclamationmark.triangle","status":"warning","value":16,"unit":"Stk","decimals":0,"categories":["Maßabweichung","Schweißnaht","Lackfehler","Riss","Dichtheit"],"series":[{"name":"Stück","values":[5,4,3,2,2]}],"subtext":"Größter Anteil Maßabweichung 5 Stk · Quote 2,7 %"},{"id":"t_causes","view":"pie","title":"Stillstandsursachen Schicht","titleShort":"Ursachen","icon":"chart.pie.fill","unit":"min","decimals":0,"categories":["Rüsten","Materialmangel","Störung","Wartung"],"series":[{"name":"Minuten","values":[16,30,3,8]}],"subtext":"Summe 57 min von 390 min Schichtzeit"},{"id":"t_pieces_hour","view":"bar","title":"Stück je Schichtstunde","titleShort":"Stück/h","icon":"chart.bar.fill","unit":"Stk","decimals":0,"series":[{"name":"Ist","start":"2026-09-22T12:00:00Z","stepSec":3600,"points":[91,79,107,102,98,66,54]},{"name":"Soll","start":"2026-09-22T12:00:00Z","stepSec":3600,"points":[113,113,113,113,113,113,57]}]},{"id":"t_down_hour","view":"bar","title":"Stillstand je Schichtstunde","titleShort":"Stillstand","icon":"pause.circle","unit":"min","decimals":0,"series":[{"name":"Stillstand","start":"2026-09-22T12:00:00Z","stepSec":3600,"points":[9,16,0,3,5,23,1]}]},{"id":"t_scrap_station","view":"bar","title":"Ausschuss je Station","titleShort":"Station","icon":"chart.bar.xaxis","unit":"Stk","decimals":0,"categories":["Presse 1","Presse 2","Schweißzelle","Lackierung","Prüfstand"],"series":[{"name":"Ausschuss","values":[5,3,4,3,1],"statuses":["warning",null,"warning",null,null]}],"subtext":"Schicht · Warnung ab 0,6 % der Stückzahl je Station"},{"id":"t_oven","view":"gauge","title":"Trockenofen Lackierung","titleShort":"Ofen","icon":"thermometer.medium","status":"ok","value":185.6,"unit":"°C","decimals":1,"range":{"min":140,"max":215},"target":185,"bands":[{"to":165,"status":"critical"},{"to":175,"status":"warning"},{"to":195,"status":"ok"},{"to":215,"status":"critical"}],"subtext":"Lackierung läuft seit 18:04"},{"id":"t_stations","view":"table","title":"Stationen Linie 1","titleShort":"Stationen","icon":"tablecells","columns":[{"title":"Station"},{"title":"Zustand"},{"title":"Takt","unit":"s","decimals":1},{"title":"Stück","unit":"Stk","decimals":0},{"title":"Ausschuss","unit":"Stk","decimals":0}],"rows":[{"cells":["Presse 1","Läuft",31.9,596,5],"status":"ok"},{"cells":["Presse 2","Läuft",32.1,595,3],"status":"ok"},{"cells":["Schweißzelle","Läuft",32.3,594,4],"status":"ok"},{"cells":["Lackierung","Läuft",32.5,593,3],"status":"ok"},{"cells":["Prüfstand","Läuft",32.7,591,1],"status":"ok"}],"subtext":"Zustand und Takt jetzt · Stück und Ausschuss der Schicht, nach Verursacher"},{"id":"t_history","view":"timeline","title":"Zustandsverlauf Schicht","titleShort":"Verlauf","from":"2026-09-22T12:00:00Z","to":"2026-09-22T20:00:00Z","states":[{"id":"run","label":"Läuft","status":"ok"},{"id":"setup","label":"Rüsten","status":"warning"},{"id":"starved","label":"Materialmangel","status":"warning"},{"id":"fault","label":"Störung","status":"critical"},{"id":"maint","label":"Wartung"}],"lanes":[{"name":"Presse 1","segments":[["2026-09-22T12:00:00Z","run"],["2026-09-22T13:16:09Z","starved"],["2026-09-22T13:21:01Z","run"],["2026-09-22T15:56:03Z","fault"],["2026-09-22T15:59:32Z","run"],["2026-09-22T18:21:05Z","setup"],["2026-09-22T18:21:50Z","run"]]},{"name":"Presse 2","segments":[["2026-09-22T12:00:00Z","run"],["2026-09-22T13:09:55Z","starved"],["2026-09-22T13:17:53Z","run"],["2026-09-22T17:21:48Z","maint"],["2026-09-22T17:32:39Z","run"]]},{"name":"Schweißzelle","segments":[["2026-09-22T12:00:00Z","run"],["2026-09-22T12:34:01Z","starved"],["2026-09-22T12:39:27Z","run"],["2026-09-22T17:29:13Z","starved"],["2026-09-22T17:38:48Z","run"]]},{"name":"Lackierung","segments":[["2026-09-22T12:00:00Z","run"],["2026-09-22T13:05:26Z","setup"],["2026-09-22T13:10:25Z","run"],["2026-09-22T15:58:20Z","setup"],["2026-09-22T16:04:38Z","run"]]},{"name":"Prüfstand","segments":[["2026-09-22T12:00:00Z","run"],["2026-09-22T12:52:01Z","starved"],["2026-09-22T12:56:27Z","run"],["2026-09-22T17:35:12Z","setup"],["2026-09-22T17:44:36Z","run"]]}],"subtext":"Spätschicht 14:00–22:00"}]}
